VenueCode,TemplateName,SectionCode,Section,Priority,StatusCode,Color,Justification
214,CHURCHCOVENANT1,LEFTB,Far Left (Price B),5,A,Gold,Left
214,CHURCHCOVENANT1,LEFTC,Far Left (Price C),7,A,Gray,Left
214,CHURCHCOVENANT1,LFTCA,Left Center (Price A),1,A,Orange,Left
214,CHURCHCOVENANT1,LFTCB,Left Center (Price B),3,A,Gold,Left
214,CHURCHCOVENANT1,RGTCA,Right Center (Price A),2,A,Orange,Left
214,CHURCHCOVENANT1,RGTCB,Right Center (Price B),4,A,Gold,Left
214,CHURCHCOVENANT1,RGHTB,Far Right (Price B),6,A,Gold,Left
214,CHURCHCOVENANT1,RGHTC,Far Right (Price C),8,A,Gray,Left
