VenueCode,TemplateName,SectionCode,Section,Priority,StatusCode,Color,Justification,SectionType,Shape,Coordinates
1955,THOMASAQUINAS1,LSIDE,LEFT SIDE GENERAL ADMISSION,51,A,BLUE,LEFT,general,POLY,"5,97,48,97,48,121,64,121,64,134,80,134,80,421,4,421,4,421"
1955,THOMASAQUINAS1,RSIDE,RIGHT SIDE GENERAL ADMISSION,52,A,BLUE,LEFT,general,POLY,"355,421,430,421,431,134,429,121,428,95,387,95,387,121,429,121,430,136,356,136,356,136"
1955,THOMASAQUINAS1,ROWAL,ROW AL GENERAL ADMISSION,1,A,GOLD,LEFT,general,RECT,"115,71,202,81"
1955,THOMASAQUINAS1,ROWBL,ROW BL GENERAL ADMISSION,3,A,GOLD,LEFT,general,RECT,"114,84,203,94"
1955,THOMASAQUINAS1,ROWCL,ROW CL GENERAL ADMISSION,5,A,GOLD,LEFT,general,RECT,"113,97,203,107"
1955,THOMASAQUINAS1,ROWDL,ROW DL GENERAL ADMISSION,7,A,GOLD,LEFT,general,RECT,"114,110,203,120"
1955,THOMASAQUINAS1,ROWEL,ROW EL GENERAL ADMISSION,9,A,GOLD,LEFT,general,RECT,"114,123,203,133"
1955,THOMASAQUINAS1,ROWFL,ROW FL GENERAL ADMISSION,11,A,GOLD,LEFT,general,RECT,"114,136,202,146"
1955,THOMASAQUINAS1,ROWGL,ROW GL GENERAL ADMISSION,13,A,GOLD,LEFT,general,RECT,"114,150,203,159"
1955,THOMASAQUINAS1,ROWHL,ROW HL GENERAL ADMISSION,15,A,GOLD,LEFT,general,RECT,"115,163,202,173"
1955,THOMASAQUINAS1,ROWIL,ROW IL GENERAL ADMISSION,17,A,GOLD,LEFT,general,RECT,"114,176,202,186"
1955,THOMASAQUINAS1,ROWJL,ROW JL GENERAL ADMISSION,19,A,GOLD,LEFT,general,RECT,"114,189,203,199"
1955,THOMASAQUINAS1,ROWKL,ROW KL GENERAL ADMISSION,21,A,GOLD,LEFT,general,RECT,"114,203,203,212"
1955,THOMASAQUINAS1,ROWLL,ROW LL GENERAL ADMISSION,23,A,GOLD,LEFT,general,RECT,"114,216,203,225"
1955,THOMASAQUINAS1,ROWML,ROW ML GENERAL ADMISSION,25,A,BLUE,LEFT,general,RECT,"113,252,203,262"
1955,THOMASAQUINAS1,ROWNL,ROW NL GENERAL ADMISSION,27,A,BLUE,LEFT,general,RECT,"114,266,203,276"
1955,THOMASAQUINAS1,ROWOL,ROW OL GENERAL ADMISSION,29,A,BLUE,LEFT,general,RECT,"113,280,203,289"
1955,THOMASAQUINAS1,ROWPL,ROW PL GENERAL ADMISSION,31,A,BLUE,LEFT,general,RECT,"115,293,204,302"
1955,THOMASAQUINAS1,ROWQL,ROW QL GENERAL ADMISSION,33,A,BLUE,LEFT,general,RECT,"114,306,203,315"
1955,THOMASAQUINAS1,ROWRL,ROW RL GENERAL ADMISSION,35,A,BLUE,LEFT,general,RECT,"114,318,203,329"
1955,THOMASAQUINAS1,ROWSL,ROW SL GENERAL ADMISSION,37,A,BLUE,LEFT,general,RECT,"115,332,202,342"
1955,THOMASAQUINAS1,ROWTL,ROW TL GENERAL ADMISSION,39,A,BLUE,LEFT,general,RECT,"114,346,203,355"
1955,THOMASAQUINAS1,ROWUL,ROW UL GENERAL ADMISSION,41,A,BLUE,LEFT,general,RECT,"115,358,203,367"
1955,THOMASAQUINAS1,ROWVL,ROW VL GENERAL ADMISSION,43,A,BLUE,LEFT,general,RECT,"115,372,203,381"
1955,THOMASAQUINAS1,ROWWL,ROW WL GENERAL ADMISSION,45,A,BLUE,LEFT,general,RECT,"112,384,203,394"
1955,THOMASAQUINAS1,ROWXL,ROW XL GENERAL ADMISSION,47,A,BLUE,LEFT,general,RECT,"115,398,203,408"
1955,THOMASAQUINAS1,ROWYL,ROW YL GENERAL ADMISSION,49,A,BLUE,LEFT,general,RECT,"114,411,203,421"
1955,THOMASAQUINAS1,ROWAR,ROW AR GENERAL ADMISSION,2,A,GOLD,LEFT,general,RECT,"231,70,318,80"
1955,THOMASAQUINAS1,ROWBR,ROW BR GENERAL ADMISSION,4,A,GOLD,LEFT,general,RECT,"230,84,318,93"
1955,THOMASAQUINAS1,ROWCR,ROW CR GENERAL ADMISSION,6,A,GOLD,LEFT,general,RECT,"230,97,319,107"
1955,THOMASAQUINAS1,ROWDR,ROW DR GENERAL ADMISSION,8,A,GOLD,LEFT,general,RECT,"231,110,318,119"
1955,THOMASAQUINAS1,ROWER,ROW ER GENERAL ADMISSION,10,A,GOLD,LEFT,general,RECT,"229,123,318,133"
1955,THOMASAQUINAS1,ROWFR,ROW FR GENERAL ADMISSION,12,A,GOLD,LEFT,general,RECT,"230,137,319,146"
1955,THOMASAQUINAS1,ROWGR,ROW GR GENERAL ADMISSION,14,A,GOLD,LEFT,general,RECT,"230,150,319,159"
1955,THOMASAQUINAS1,ROWHR,ROW HR GENERAL ADMISSION,16,A,GOLD,LEFT,general,RECT,"230,163,319,172"
1955,THOMASAQUINAS1,ROWIR,ROW IR GENERAL ADMISSION,18,A,GOLD,LEFT,general,RECT,"230,176,317,186"
1955,THOMASAQUINAS1,ROWJR,ROW JR GENERAL ADMISSION,20,A,GOLD,LEFT,general,RECT,"232,189,317,200"
1955,THOMASAQUINAS1,ROWKR,ROW KR GENERAL ADMISSION,22,A,GOLD,LEFT,general,RECT,"229,203,319,212"
1955,THOMASAQUINAS1,ROWLR,ROW LR GENERAL ADMISSION,24,A,GOLD,LEFT,general,RECT,"230,216,319,225"
1955,THOMASAQUINAS1,ROWMR,ROW MR GENERAL ADMISSION,26,A,BLUE,LEFT,general,RECT,"231,252,318,264"
1955,THOMASAQUINAS1,ROWNR,ROW NR GENERAL ADMISSION,28,A,BLUE,LEFT,general,RECT,"231,266,318,275"
1955,THOMASAQUINAS1,ROWOR,ROW OR GENERAL ADMISSION,30,A,BLUE,LEFT,general,RECT,"230,279,318,289"
1955,THOMASAQUINAS1,ROWPR,ROW PR GENERAL ADMISSION,32,A,BLUE,LEFT,general,RECT,"230,293,319,302"
1955,THOMASAQUINAS1,ROWQR,ROW QR GENERAL ADMISSION,34,A,BLUE,LEFT,general,RECT,"230,306,319,315"
1955,THOMASAQUINAS1,ROWRR,ROW RR GENERAL ADMISSION,36,A,BLUE,LEFT,general,RECT,"230,319,318,329"
1955,THOMASAQUINAS1,ROWSR,ROW SR GENERAL ADMISSION,38,A,BLUE,LEFT,general,RECT,"230,333,319,342"
1955,THOMASAQUINAS1,ROWTR,ROW TR GENERAL ADMISSION,40,A,BLUE,LEFT,general,RECT,"231,345,318,355"
1955,THOMASAQUINAS1,ROWUR,ROW UR GENERAL ADMISSION,42,A,BLUE,LEFT,general,RECT,"230,358,319,368"
1955,THOMASAQUINAS1,ROWVR,ROW VR GENERAL ADMISSION,44,A,BLUE,LEFT,general,RECT,"230,372,318,381"
1955,THOMASAQUINAS1,ROWWR,ROW WR GENERAL ADMISSION,46,A,BLUE,LEFT,general,RECT,"231,386,319,395"
1955,THOMASAQUINAS1,ROWXR,ROW XR GENERAL ADMISSION,48,A,BLUE,LEFT,general,RECT,"230,397,319,408"
1955,THOMASAQUINAS1,ROWYR,ROW YR GENERAL ADMISSION,50,A,BLUE,LEFT,general,RECT,"230,411,318,421"
